{
  "acceptedAt": "2026-08-10T22:21:37.754Z",
  "candidate": {
    "master": {
      "bytes": 1523013,
      "height": 1254,
      "sha256": "11b803d6b3753acab20121b7e526019c67d314740d3b200ccbd423de4c6ea813",
      "width": 1254
    },
    "runtime": {
      "bytes": 154951,
      "height": 360,
      "sha256": "f25b54f74670c372159714affac8b76097fb7b25d52d9c0bc76df98f1ef28959",
      "width": 360
    }
  },
  "inputAllowlist": {
    "files": [
      {
        "bytes": 1523013,
        "height": 1254,
        "path": "inputs/master.png",
        "sha256": "11b803d6b3753acab20121b7e526019c67d314740d3b200ccbd423de4c6ea813",
        "width": 1254
      },
      {
        "bytes": 154951,
        "height": 360,
        "path": "inputs/runtime.png",
        "sha256": "f25b54f74670c372159714affac8b76097fb7b25d52d9c0bc76df98f1ef28959",
        "width": 360
      }
    ],
    "schemaVersion": "g002-v2-canonical-review-allowlist-v1"
  },
  "inputAllowlistSha256": "e8c8fd5df6b0fd1ac5cd07dccc4522bcb92d605fca0bfb3e5d07f7e72afe6008",
  "materialBinding": {
    "allowlistSha256": "e8c8fd5df6b0fd1ac5cd07dccc4522bcb92d605fca0bfb3e5d07f7e72afe6008",
    "candidate": {
      "master": {
        "bytes": 1523013,
        "height": 1254,
        "sha256": "11b803d6b3753acab20121b7e526019c67d314740d3b200ccbd423de4c6ea813",
        "width": 1254
      },
      "runtime": {
        "bytes": 154951,
        "height": 360,
        "sha256": "f25b54f74670c372159714affac8b76097fb7b25d52d9c0bc76df98f1ef28959",
        "width": 360
      }
    },
    "conductorHmacSha256": "050b2392061fdc1cd51b3d4444e08c0821a7ce3faed8d9ceb6222503c105c1a1",
    "opaqueTargetId": "target-600c40991213e93ae591325b",
    "outputSha256": "358c90c1bb8873a040346943be230aa93fdfadf5a8e54407c98f7377c54515e6",
    "packageManifestSha256": "3a028000e2a6a08637d7df5e1571e1e4afbaf46249ff918836750ad4121b2ca4",
    "promptSha256": "f14d24ab249b9aca74c3921cc6fc90c12e9ec7f44f67366516285d42d1c0f0ab",
    "rootId": "PG-024",
    "schemaVersion": "g002-v2-canonical-private-binding-v1",
    "sourcePaths": {
      "master": "assets/creatures/biological-continuity-v3/candidates/g003-w0-pg024-r2/PG-024/master.png",
      "runtime": "assets/creatures/biological-continuity-v3/candidates/g003-w0-pg024-r2/PG-024/runtime.png"
    },
    "targetSha256": "de05fc777316c2f97714969f72ed20b72184fafe5bc19667667cbf27157e0101"
  },
  "materialBindingSha256": "358c90c1bb8873a040346943be230aa93fdfadf5a8e54407c98f7377c54515e6",
  "opaqueTargetId": "target-600c40991213e93ae591325b",
  "outputSha256": "1c4bc2641d32005bd6afcc6f9ce652dab2693c1f80eb904f8bd0c7d5f75d281c",
  "packageManifest": {
    "candidate": {
      "master": {
        "bytes": 1523013,
        "height": 1254,
        "sha256": "11b803d6b3753acab20121b7e526019c67d314740d3b200ccbd423de4c6ea813",
        "width": 1254
      },
      "runtime": {
        "bytes": 154951,
        "height": 360,
        "sha256": "f25b54f74670c372159714affac8b76097fb7b25d52d9c0bc76df98f1ef28959",
        "width": 360
      }
    },
    "opaqueTargetId": "target-600c40991213e93ae591325b",
    "schemaVersion": "g002-v2-canonical-review-package-v1",
    "target": {
      "anchors": [
        {
          "anchorId": "eight-separate-mechanical-walking-legs",
          "description": "Exactly eight separate mechanical spider walking legs with independently readable feet"
        },
        {
          "anchorId": "four-pink-eyes-and-paired-gold-fangs",
          "description": "Compact round teal head with exactly four pink eyes and paired gold fangs"
        },
        {
          "anchorId": "four-pink-rimmed-dorsal-ports-and-gold-braces",
          "description": "Spherical armored teal abdomen with exactly four pink-rimmed dorsal ports and gold circuit braces"
        }
      ],
      "canonicalTarget": {
        "biologicalClass": "arachnida",
        "coreAnatomy": "eight-legged-chelicerate",
        "locomotionPlan": "terrestrial-octopedal",
        "speciesFamily": "stylized-mechanical-spider"
      },
      "clarificationRequirements": [
        "Master and runtime must each show all eight blue-and-gold jointed walking legs without merging or occlusion",
        "Preserve exactly four pink eyes on the compact round teal head and paired gold fangs in their original placement",
        "Preserve exactly four pink-rimmed dorsal ports and gold circuit braces on the spherical armored teal abdomen",
        "Reject extra eyes, extra fangs, extra dorsal ports, or altered anchor colors and relative placements",
        "Do not count fangs, mouthparts, shadows, or doubled joints as walking legs"
      ],
      "currentPixelAssessment": "DISPUTED_OR_AMBIGUOUS"
    },
    "visibleAppendageRequirements": {
      "dorsalPorts": 4,
      "eyes": 4,
      "fangs": 2,
      "walkingLegs": 8
    }
  },
  "packageManifestSha256": "3a028000e2a6a08637d7df5e1571e1e4afbaf46249ff918836750ad4121b2ca4",
  "passes": [
    {
      "assignment": {
        "agentTaskId": "/root/g002_v2_blind_pass1",
        "assignedAt": "2026-08-10T22:18:04.000Z",
        "assignmentId": "assignment-1d9c4f7e6c6c0cbf51c9ec7b",
        "conductorHmacSha256": "28919d17ff905ad9cc8c9d5d0e9f6a558ef81dc25b61d8d923d9a26521bb53c0",
        "inputAllowlistSha256": "e8c8fd5df6b0fd1ac5cd07dccc4522bcb92d605fca0bfb3e5d07f7e72afe6008",
        "inputAssetSha256s": [
          "11b803d6b3753acab20121b7e526019c67d314740d3b200ccbd423de4c6ea813",
          "f25b54f74670c372159714affac8b76097fb7b25d52d9c0bc76df98f1ef28959"
        ],
        "materialBindingSha256": "358c90c1bb8873a040346943be230aa93fdfadf5a8e54407c98f7377c54515e6",
        "opaqueTargetId": "target-600c40991213e93ae591325b",
        "outputSha256": "bd7597e32f845dc2dac2e061585f0e468be16aa033e1f8bb4c5dedaa8b391cae",
        "packageManifestSha256": "3a028000e2a6a08637d7df5e1571e1e4afbaf46249ff918836750ad4121b2ca4",
        "passNumber": 1,
        "promptSha256": "f14d24ab249b9aca74c3921cc6fc90c12e9ec7f44f67366516285d42d1c0f0ab",
        "reviewRunId": "g002-v2-canonical-pass-1-20260810",
        "reviewerInstanceId": "blind-primary-reviewer-1-20260810",
        "schemaVersion": "g002-v2-canonical-review-assignment-v1"
      },
      "raw": {
        "agentTaskId": "/root/g002_v2_blind_pass1",
        "assignmentId": "assignment-1d9c4f7e6c6c0cbf51c9ec7b",
        "confidence": 0.98,
        "observedAt": "2026-08-10T22:19:29.000Z",
        "passNumber": 1,
        "reviewRunId": "g002-v2-canonical-pass-1-20260810",
        "reviewerInstanceId": "blind-primary-reviewer-1-20260810",
        "surfaces": [
          {
            "ambiguity": false,
            "anchors": [
              {
                "anchorId": "eight-separate-mechanical-walking-legs",
                "evidence": "Four blue-and-gold jointed legs on each side are individually outlined from body to eight separate pointed feet.",
                "visible": true
              },
              {
                "anchorId": "four-pink-eyes-and-paired-gold-fangs",
                "evidence": "The round teal face visibly carries four pink eyes and two separate curved gold fangs.",
                "visible": true
              },
              {
                "anchorId": "four-pink-rimmed-dorsal-ports-and-gold-braces",
                "evidence": "The spherical teal abdomen visibly carries four open pink rings within a gold-braced shell.",
                "visible": true
              }
            ],
            "clarifications": [
              {
                "evidence": "Eight complete blue-and-gold leg silhouettes terminate in eight isolated gold feet.",
                "passed": true,
                "requirement": "Master and runtime must each show all eight blue-and-gold jointed walking legs without merging or occlusion"
              },
              {
                "evidence": "Four pink eye disks occupy the teal face and one gold fang hangs at each lower side.",
                "passed": true,
                "requirement": "Preserve exactly four pink eyes on the compact round teal head and paired gold fangs in their original placement"
              },
              {
                "evidence": "Four pink-rimmed openings and connected gold braces are plainly separated across the rounded abdomen.",
                "passed": true,
                "requirement": "Preserve exactly four pink-rimmed dorsal ports and gold circuit braces on the spherical armored teal abdomen"
              },
              {
                "evidence": "Only four pink eyes, two gold fangs, and four pink-rimmed ports are visible in the stated color arrangement.",
                "passed": true,
                "requirement": "Reject extra eyes, extra fangs, extra dorsal ports, or altered anchor colors and relative placements"
              },
              {
                "evidence": "The eight legs are continuous lateral jointed structures distinct from the two central fangs, facial mouth, and soft shadow.",
                "passed": true,
                "requirement": "Do not count fangs, mouthparts, shadows, or doubled joints as walking legs"
              }
            ],
            "confidence": 0.99,
            "inputSha256": "11b803d6b3753acab20121b7e526019c67d314740d3b200ccbd423de4c6ea813",
            "surface": "master",
            "taxonomy": {
              "biologicalClass": "arachnida",
              "coreAnatomy": "eight-legged-chelicerate",
              "locomotionPlan": "terrestrial-octopedal",
              "speciesFamily": "stylized-mechanical-spider"
            },
            "visibleAppendageCounts": {
              "dorsalPorts": 4,
              "eyes": 4,
              "fangs": 2,
              "walkingLegs": 8
            }
          },
          {
            "ambiguity": false,
            "anchors": [
              {
                "anchorId": "eight-separate-mechanical-walking-legs",